{
  "slug": "wuque-studio-paper80-whatever-studio",
  "name": "Paper80 x Whatever Studio",
  "vendorSlug": "wuque-studio",
  "productSlug": null,
  "productKind": "board",
  "startDate": "2026-03-31",
  "endDate": "2026-04-14",
  "region": "global",
  "url": "https://shop.wuquestudio.com/products/gb-paper-80-whatever-studio",
  "heroImage": "/group-buy-art/wuque-studio-paper80-whatever-studio.svg",
  "heroImageAlt": "80% TKL-style keyboard outline with a diagonal paper-airplane mid-case fold; ochre fills the folded triangle",
  "status": "closed",
  "description": "80-percent aluminum board with lock-hole gasket mount and a paper-airplane-inspired mid-case fold, supporting ANSI/ISO and PC or aluminum plates; GB has wrapped, with limited follow-on stock.",
  "updatedAt": "2026-05-09T20:00:00.000Z"
}
