{
  "slug": "divinikey-dcs-dolch",
  "name": "DCS Dolch",
  "vendorSlug": "divinikey",
  "productSlug": null,
  "productKind": "keycap-set",
  "startDate": "2026-06-01",
  "endDate": "2026-07-01",
  "region": "global",
  "url": "https://divinikey.com/products/dcs-dolch-keycaps",
  "heroImage": "/group-buy-art/divinikey-dcs-dolch.svg",
  "heroImageAlt": "Five DCS-profile keycaps in a cluster evoking the vintage dark-alpha Dolch colorway",
  "status": "closed",
  "description": "DCS Dolch — classic Dolch colorway (dark grey alphas, light grey mods) in DCS profile by Signature Plastics, designed by cartersrush; running June 1–July 1 2026 via Divinikey (NA), Prototypist (UK), Keebsupply and DeltakeyCo (EU), and six other regional vendors. Base kit $119–$128 MOQ-tiered; estimated October 2026 ship.",
  "relatedArticle": "divinikey-dcs-dolch-group-buy",
  "updatedAt": "2026-07-03T18:30:00.000Z"
}
