{
  "slug": "divinikey-gmk-cyl-ta-neo",
  "name": "GMK CYL TA Neo",
  "vendorSlug": "divinikey",
  "productSlug": null,
  "productKind": "keycap-set",
  "startDate": "2026-06-19",
  "endDate": "2026-07-17",
  "region": "global",
  "url": "https://divinikey.com/products/gmk-ta-neo-keycaps",
  "heroImage": "/group-buy-art/divinikey-gmk-cyl-ta-neo.svg",
  "heroImageAlt": "A cluster of GMK CYL keycaps in a cool slate-and-neon TA Neo colorway, evoking the set's returning-classic aesthetic",
  "status": "closed",
  "description": "GMK CYL TA Neo — a returning classic colorway in Base, Extensions, R5, BAE, and Deutsche Mods kits, running June 19–July 17 2026 via Divinikey (NA), Oblotzky Industries (EU), Prototypist (UK), and other regional vendors including zFrontier (China). Base kit $145; estimated November 2026 ship.",
  "relatedArticle": "gmk-cyl-ta-neo-production-tracking",
  "updatedAt": "2026-08-07T00:00:00.000Z"
}
