{
  "slug": "novelkeys-gmk-cyl-og-extensions",
  "name": "GMK CYL OG Extensions",
  "vendorSlug": "novelkeys",
  "productSlug": null,
  "productKind": "keycap-set",
  "startDate": "2026-07-15",
  "endDate": "2026-08-12",
  "region": "global",
  "url": "https://novelkeys.com/products/gmk-cyl-og-extensions",
  "heroImage": "/group-buy-art/novelkeys-gmk-cyl-og-extensions.svg",
  "heroImageAlt": "A cluster of four warm-bronze 1.25u modifier caps framing one wide terracotta spacebar, reflecting a bottom-row extensions kit rather than a full set",
  "status": "live",
  "description": "An R4 extensions kit adding bottom-row and spacebar options for existing GMK CYL colorways, kitted through NovelKeys (NA) and Prototypist (UK). Climbed eight straight interest-check weeks on the thock trends tracker before opening a group buy of its own July 15, 2026, running through an August 12 close.",
  "relatedArticle": "gmk-cyl-og-extensions-interest-check",
  "updatedAt": "2026-08-07T00:00:00.000Z"
}
