{
  "slug": "divinikey-gmk-cyl-orange-alert",
  "name": "GMK CYL Orange Alert",
  "vendorSlug": "divinikey",
  "productSlug": null,
  "productKind": "keycap-set",
  "startDate": "2026-08-14",
  "endDate": "2026-09-14",
  "region": "global",
  "url": "https://divinikey.com/products/gmk-cyl-orange-alert-keycaps",
  "heroImage": "/group-buy-art/divinikey-gmk-cyl-orange-alert.svg",
  "heroImageAlt": "Four CYL-profile keycaps in a cluster, warm-grey line strokes with a coral-orange wash across two center alpha caps and small abstracted Katakana-style accent glyphs, evoking GMK CYL Orange Alert's industrial orange-beige-gray palette",
  "status": "closed",
  "description": "GMK CYL Orange Alert — a Cherry-profile doubleshot ABS keycap set in GMK's Alert series, pairing an orange (GMK Orenji-matched), beige, and gray palette with Katakana accent legends for an industrial, technical look. Running August 14-September 14, 2026 across Divinikey, KBDfans, UniKeys, Keebz N Cables, and other regional vendors; estimated shipping February 2027.",
  "relatedArticle": "divinikey-gmk-cyl-orange-alert-group-buy",
  "updatedAt": "2026-10-02T00:00:00.000Z"
}
