{
  "slug": "kbdfans-gmk-cyl-selene",
  "name": "GMK CYL Selene",
  "vendorSlug": "kbdfans",
  "productSlug": "gmk-cyl-selene",
  "productKind": "keycap-set",
  "startDate": "2026-05-15",
  "endDate": "2026-06-19",
  "region": "global",
  "url": "https://kbdfans.com/products/gmk-cyl-selene",
  "heroImage": "/group-buy-art/kbdfans-gmk-cyl-selene.svg",
  "heroImageAlt": "Five Cherry-profile keycaps, alpha and modifier heights, dusty rose focal splash on a moon-goddess theme",
  "status": "closed",
  "description": "Designed by whysoda and inspired by the Greek Titaness of the Moon, GMK CYL Selene uses GMK's special-effects ABS plastic to produce a rainbow glitter reflect in purple and teal across a silver-grey base. Double-shot Cherry profile, manufactured in Germany, with kits covering ISO layouts, novelties depicting moon phases, and a dedicated spacebar kit. Global buy running May–June 2026 with Q1-Q2 2027 fulfillment.",
  "relatedArticle": "gmk-cyl-selene-group-buy",
  "updatedAt": "2026-07-24T00:00:00.000Z"
}
