{
  "slug": "cannonkeys-blaine-v2-se",
  "name": "Blaine V2: SE",
  "vendorSlug": "cannonkeys",
  "productSlug": null,
  "productKind": "board",
  "startDate": "2026-07-10",
  "endDate": "2026-08-09",
  "region": "global",
  "url": "https://cannonkeys.com/products/blaine-v2",
  "heroImage": "/group-buy-art/cannonkeys-blaine-v2-se.svg",
  "heroImageAlt": "F12 TKL aluminum keyboard kit with carbon-fiber bottom plate, warm terracotta colorway",
  "status": "closed",
  "description": "Blaine V2: SE — F12 TKL aluminum keyboard kit with a carbon-fiber bottom plate, triple mount system (top mount, single-sided gasket, o-ring), and a POM volcano light-diffusing element on the underside. Offered in Classic, Volcano, Seafoam, and Mystery colorways with solder or hotswap PCB options. Group buy run by CannonKeys, 2026-07-10 through 2026-08-09; estimated shipping Q1 2027.",
  "relatedArticle": "cannonkeys-blaine-v2-se-group-buy",
  "updatedAt": "2026-08-10T00:00:00.000Z"
}
